21:32:49.912146 IP 172.31.44.62.22 > 142.157.147.85.54177: Flags [P.], seq 1885705657:1885705853, ack 121417708, win 339, options [nop,nop,TS val 25678928 ecr 38275587], length 196
21:32:49.977968 IP 142.157.147.85.54177 > 172.31.44.62.22: Flags [.], ack 0, win 1444, options [nop,nop,TS val 38275605 ecr 25678926], length 0
21:32:49.985463 IP 142.157.147.85.54177 > 172.31.44.62.22: Flags [.], ack 196, win 1444, options [nop,nop,TS val 38275607 ecr 25678928], length 0
21:32:58.553186 IP 142.157.147.85.60100 > 172.31.44.62.60100: UDP, length 98
21:32:58.553356 IP 172.31.44.62.22 > 142.157.147.85.54217: Flags [P.], seq 2779351999:2779352163, ack 3638981576, win 296, options [nop,nop,TS val 25681089 ecr 38266082], length 164
21:32:58.553418 IP 20.20.20.20 > 172.31.32.1: ICMP echo request, id 42060, seq 0, length 64
21:32:58.832583 IP 172.31.44.62.22 > 142.157.147.85.54217: Flags [P.], seq 0:164, ack 1, win 296, options [nop,nop,TS val 25681159 ecr 38266082], length 164
21:32:59.112610 IP 172.31.44.62.22 > 142.157.147.85.54217: Flags [P.], seq 0:164, ack 1, win 296, options [nop,nop,TS val 25681229 ecr 38266082], length 164
21:32:59.672580 IP 172.31.44.62.22 > 142.157.147.85.54217: Flags [P.], seq 0:164, ack 1, win 296, options [nop,nop,TS val 25681369 ecr 38266082], length 164

